{
  "$schema": "../../../schemas/state.schema.json",
  "schema_version": 1,
  "film_id": "synthetic-demo-001",
  "title": "Synthetic Demo",
  "current_status": "PROJECT_CREATED",
  "workflow_control": {
    "status": "ACTIVE",
    "execution_mode": "SINGLE_MAIN_DIRECTOR",
    "fixed_role_threads": false,
    "master_skill": "movie-master-director"
  },
  "canonical_project": "project.json",
  "locks": {
    "index": null,
    "script": null,
    "voice": null,
    "narration": null,
    "director_plan": null,
    "final_render": null,
    "second_review": null
  },
  "next_legal_action": {
    "responsible_skill": "movie-index",
    "action": "Generate local synthetic media, then verify the evidence index."
  }
}
